No,Destination,Ratings,Tags,Description,Accommodation,Shopping,Transportation,AdventureLevel,Cuisine,Tourist_Attraction_1,Tourist_Attraction_2,Tourist_Attraction_3,Spiritual,Nature,Crowded,Nightlife,Average Budget,Latitude,Longitude
42,Jammu &Kashmir,4.1," ""Paradise on the Earth"" "," Popularly known as the ""Paradise on Earth,"" Jammu and Kashmir is a tourist favorite for its scenic splendor, snow-capped mountains, plentiful wildlife, exquisite monuments, hospitable people, and local people handicrafts. Nestled in the Himalayan, Pir Panjal and Karakoram mountain ranges are renowned for their natural beauty and gentle people. Kashmir is memorable, as it's not only a nature lover's paradise but also a must-visit place for all adventure junkies.",Hotels,Local Markets,Car,High-Nice,Kashmiri Cuisine,Dal Lake,Shankaracharya Temple,Pari Mahal,4,5,3,2,3724,33.7782,76.5762
43,Jim Corbett National Park,4," ""Home to the Royal Bengal Tiger"" "," Jim Corbett National Park is the oldest national park set amidst the foothills of the Himalayas in the Nainital district of Uttarakhand. Known for housing the endangered Bengal tiger, Corbett National Park is part of the larger Corbett Tiger Reserve.",Resorts,Local Shops,Jeep Safari,High-Nice,North Indian Cuisine,Corbett Falls,Garjia Temple,Jim Corbett Museum,2,5,3,1,3724,29.5405,78.8496
44,Jodhpur,4.2," ""The Blue City"" "," Jodhpur is the second-largest city in Rajasthan and the former capital of the Marwar region. It is popularly called ""the Blue City"" as it looks completely blue from an aerial view because of its blue walls and houses. Jodhpur is primarily famous for its temples, lakes and snacks, with the magnificent Mehrangarh Fort being the main attraction.",Hotels,Markets,Auto Rickshaws,Medium-Rajasthani Cuisine,Jodhpur,Mehrangarh Fort,Jaswant Thada,Umaid Bhawan Palace,3,4,3,3,3724,26.2389,73.0243
45,Jog Falls,4.4," ""Second Highest Waterfall in India"" "," The second-highest plunge waterfall in India, Jog Falls is a major tourist attraction in Karnataka and is the highest waterfall in the state. Second, to the Nohkalikai Falls of Meghalaya, Jog falls drops about a huge 253 m (850 ft. ) in a single fall. However, due to the construction of Linganamakki Dam which is a hydroelectricity plant closeby, the flow in the falls is hugely restricted before monsoons. So, it is best to go during the Monsoon season to see the falls in its full form.",Hotels,Local Shops,Car,High-Nice,South Indian Cuisine,Jog Falls,Sharavathi Wildlife Sanctuary,Linganamakki Dam,2,5,2,1,3724,14.1959,74.8419
46,Kalimpong,4.1," ""Home to the Royal Bengal Tiger"" "," Kalimpong is a virgin hill station in West Bengal renowned for its panoramic valley views, Buddhists monasteries and churches and Tibetan handicrafts etc.",Hotels,Local Shops,Car,High-Nice,North Eastern Cuisine,Durpin Monastery,Deolo Hill,Mangaldham,4,5,2,1,3724,27.0717,88.472
47,Kanha National Park,3.8," ""The land of Jungle Book"" "," Located in a central region of Madhya Pradesh, Kanha National Park is the largest National Park in central India and has been ranked as one of the best parks in Asia. Among the 22 species of large mammals, the royal Bengal tigers are one of the major attractions. One of the best tiger reserves in India, the present-day area stretches over the 940-kilometre square which is divided into two sanctuaries: Hallon and Banjar. ",Resorts,Local Markets,Jeep Safari,High-Nice,Central Indian Cuisine,Kanha National Park,Kanha Museum,Bamni Dadar,2,5,2,1,3724,22.3945,80.0886
48,Kanyakumari,4.1," ""Cape Comorin or The Land's End"" "," Bordered by the three seas - Arabian, Indian and the Bay of Bengal, Kanyakumari is the southernmost tip of the Indian Peninsula. A small coastal town in the state of Tamil Nadu, Kanyakumari was earlier known as Cape Comorin. ",Hotels,Local Markets,Auto Rickshaws,Medium-Great,South Indian Cuisine,Vivekananda Rock Memorial,Thiruvalluvar Statue,Kanyakumari Beach,4,4,3,2,3724,8.0883,77.5385
49,Kasauli,4," ""Cozy little hill-station"" "," Located on the road from Chandigarh to Shimla in the Solan district, Kasauli is a hilly cantonment town that makes for an ideal peaceful holiday location, especially for a weekend getaway. Mainly known for its accessibility from Chandigarh and Delhi (located just 65 km away from Chandigarh), Kasauli is not about particular attractions or activities but the beautiful villas and the serene environment.",Hotels,Local Shops,Car,Medium-Nice,North Indian Cuisine,Monkey Point,Christ Church,Gilbert Trail,3,5,2,1,3724,30.9002,76.983
50,Kasol,4.4," ""The land of Jungle Book"" "," Kasol is a quaint little village in Himachal situated along the banks of the river Parvati. Commonly known as the 'Amsterdam of India', Kasol is a tourist attraction that is rapidly gaining fame as a popular hub for trekkers, backpackers, and nature lovers. The valley is situated 23 kms from Bhuntar and next to the religious town of Manikaran and is one of the best places in the country just to sit back and chill in the panorama of snow-clad mountains, pine trees and serene river.",Hotels,Local Markets,Car,High-Nice,North Indian Cuisine,Parvati River,Kheerganga,Manikaran Sahib,3,5,3,2,3724,32.0099,77.3152
51,Kaziranga National Park,3.8," ""Home to the One Horned Rhino"" "," Home to the largest population of the one-horned rhino on earth, Kaziranga National Park is one of India’s national treasures in terms of flora and fauna. Located in the state of Assam in North-Eastern India, its total area is shared by the districts of Nagaon, Golaghat and Karbi Anglong placing it roughly at the centre of the state. Approximately around five hours by road from Guwahati, Kaziranga National Park stands tall as the epitome of successful wildlife conservation in India. In 1985, it was awarded the status of a World Heritage Site by UNESCO.",Resorts,Local Markets,Jeep Safari,High-Nice,Assamese Cuisine,Kaziranga National Park,Kaziranga Orchid and Biodiversity Park,Panbari Reserve Forest,2,5,2,1,3724,26.6758,93.171
52,Khajuraho,4.6," ""The Architectural Masterpiece"" "," Khajuraho, a UNESCO World Heritage Site located in Madhya Pradesh, is known around the world for its stunning temples adorned by erotic and sensuous carvings. A small town located in the Bundelkhand region, Khajuraho is a brilliant example of Indian architecture and its culture back in the medieval period. The architecture of these Hindu and Jain temples depict the erotic forms of love, the carvings on the walls display passion in the most sensuous yet aesthetic ways. Built between 950 to 1050 AD the sheer confrontational nature of these carvings shows a stark paradox with the conventional Indian ideals about eroticism, leaving everybody spellbound.",Hotels,Local Markets,Auto Rickshaws,Medium-Nice,North Indian Cuisine,Khajuraho Group of Monuments,Kandariya Mahadeva Temple,Duladeo Temple,4,3,2,1,3724,24.8318,79.9199
53,Khandala,3.8," ""Misty Mountains"" "," Khandala is a popular hill station in Maharashtra, perched on the foothills of Sahyadri in the Western Ghats. Khandala provides for a perfect weekend respite for the Mumbai population, with its scenic valleys, grassy hills, serene lakes and misty waterfalls.",Hotels,Local Shops,Car,Medium-Nice,Maharashtrian Cuisine,Lohagad Fort,Bhaja Caves,Kune Falls,3,5,3,1,3724,18.7528,73.405
54,Kochi,4.2," ""Queen of Arabian Sea"" "," Lying on the Malabar coast in the southwest of India, Kochi or Cochin is a port city with a trading history that dates back to at least 600 years. Known popularly as the Queen of the Arabian Sea, the city is also Kerala's financial, commercial, and industrial capital. Exuding an old-world charm with diverse linguistics, such as the Jews, Konkinis, Gujaratis, and ethnic communities like the anglo-indians, Kochi has an indiscriminate mix of backwaters, beaches, islands, coasts, and plain terrains.",Hotels,Markets,Auto Rickshaws,Medium-Great,Kerala Cuisine,Chinese Fishing Nets,Mattancherry Palace,Fort Kochi,3,4,4,3,3724,9.9312,76.2673
55,Kodaikanal,4.4," ""The Princess of Hill Stations"" "," Located in the state of Tamil Nadu, Kodaikanal is one of the most famous honeymoon destinations in India. A Lakeside resort town of Tamil Nadu, Kodaikanal has a beautiful climate, mist-covered manicured cliffs and waterfall that come together to create the ideal setting for a perfect getaway. Kodaikanal means 'the gift of the forests'.",Hotels,Local Shops,Car,Medium-Great,South Indian Cuisine,Kodaikanal Lake,Bryant Park,Coaker's Walk,3,5,3,2,3724,10.2381,77.4892
56,Kolkata,4.3," ""The city of Joy"" "," Kolkata, India's second biggest city, is a perpetually ongoing festival of human existence, concurrently luxurious and squalid, refined and frantic, pointedly futuristic, while beautifully in decay. A vibrant 350-year-old metropolis located on India's Eastern Coast, the capital of West Bengal thrives on contradictions and imposing spectacles; nothing is commonplace in this city. Famously known as the City of Joy, Kolkata is, in every sense, the artistic, cultural and intellectual capital of the country. Kolkata's streets are vivid, hectic, chaotic, and yet, brimming with life and creativity. Driven by the indomitable spirit of the self-made middle class, the city has created a beautiful juxtaposition of the old colonial-era charm with the nascent upcoming hipster culture that thrives amongst the city's millennial residents.",Hotels,Malls,Metro,Medium-Great,Bengali Cuisine,Victoria Memorial,Howrah Bridge,Dakshineswar Kali Temple,3,3,5,4,3724,22.5726,88.3639
57,Kovalam,4.2," ""Beaches, Ayurveda and Shopping"" "," Famous for its resorts and ayurvedic massage centres, Kovalam is a coastal town located around 13 km from Thiruvananthapuram in Kerala. The largest beach in Kovalam is the lighthouse beach that features a 30-metre tall lighthouse. The other two adjacent beaches are Samudra beach and Hawa beach. All these three beaches are crescent-shaped shallow water and low tidal beaches.",Resorts,Markets,Auto Rickshaws,Medium-Great,Kerala Cuisine,Lighthouse Beach,Hawa Beach,Samudra Beach,2,5,4,3,3724,8.4021,76.9782
58,Lavasa,3.9," ""India's first planned hill city"" "," Known as India's newest hill station, the Lavasa Corporation is constructing this private city. The city is a beautiful project, stylistically based on the Italian town Portofino. Spreading across 7 hills, covering an area of 25000 acres, Lavasa is a perfect blend of beauty and infrastructure.",Hotels,Local Shops,Car,Medium-Maharashtrian Cuisine,Lavasa,Lakeside Promenade,Bamboosa,Lavasa International Convention Centre,2,4,2,2,3724,18.4088,73.506
59,Leh Ladakh,4.6," ""India's Own Moonland"" "," Ladakh is a union territory in the Kashmir region of India. Formerly falling in the state of Jammu & Kashmir, Ladakh was administered a union territory on 31st October 2019. Extending from the Siachen Glacier to the main Great Himalayas, Ladakh is a land like no other. Dominated by dramatic landscapes, Ladakh is known as the world's coldest desert.",Hotels,Local Markets,Car,High-Tibetan Cuisine,Leh Ladakh,Pangong Lake,Nubra Valley,Hemis Monastery,4,5,2,1,3724,34.1526,77.577
60,Lonavala,4.1," ""Misty Weekend Getaway"" "," Situated in the Sahyadri range of the Western Ghats close to Pune and Mumbai, Lonavala is the most visited hill station in Maharashtra and the place to be during monsoons. With lots of waterfalls, lakes and hills around, it is a popular destination for camping, trekking and other adventure sports.",Hotels,Local Markets,Car,Medium-Nice,Maharashtrian Cuisine,Lion's Point,Bhushi Dam,Karla Caves,2,5,3,1,3724,18.7539,73.405
61,Lucknow,4.1," ""The City of Nawabs and Kebabs"" "," The capital and the largest city of Uttar Pradesh, Lucknow, situated on the banks of river Gomti, welcomes you with a heartwarming note of ""Muskuraiyein, kyunki aap Lucknow mein hai"". A city of kebabs and nawabs, of architecture and history, of literature and culture – that is Lucknow in a nutshell for you. From a slice of rich colonial history to modernized museums, this artistic hub of Awadh region beautifully brings together the opulence of a glittering past and the simplicity of a modern city.",Hotels,Markets,Auto Rickshaws,Medium-Nice,North Indian Cuisine,Bara Imambara,Chota Imambara,Rumi Darwaza,4,3,4,3,3724,26.8467,80.9462
62,Madikeri,4.4," ""Karnataka's Coffee Capital"" "," Generally covered as a part of trips to Coorg, Madikeri is a hill town in Karnataka with vast coffee plantations, lush forests and misty hills, all culminating into a breathtaking view. Located in Kodagu District around 6 hours from Bengaluru, Madikeri is a perfect weekend getaway. There is no pollution, no noise to hurt your ears and the cool breeze that accompanies you throughout makes your trip memorable.",Resorts,Local Shops,Car,Medium-Nice,Kodava Cuisine,Raja's Seat,Abbey Falls,Madikeri Fort,3,5,3,1,3724,12.4244,75.7384
63,Madurai,4.1," ""The Lotus City"" "," Madurai, the cultural capital of Tamil Nadu, is one of the oldest continuously inhabited cities of India. Ruled by Pandya kings for the longest time in its history, it is called as the 'Lotus City' as it was planned and built in the shape of a lotus. Madurai is known for Meenakshi Amman Temple, dedicated to the goddess Meenakshi with a sanctum for her consort, Sundareshwarar. ",Hotels,Local Markets,Auto Rickshaws,Medium-Great,Tamil Cuisine,Meenakshi Amman Temple,Thirumalai Nayakkar Palace,Alagar Koyil,4,3,3,2,3724,9.9252,78.1198
64,Mahabaleshwar,4.3," ""The land of Strawberries"" "," Mahabaleshwar is a hill station located in the Western Ghats, in Satara district of Maharashtra. Apart from its strawberries, Mahabaleshwar is also well known for its numerous rivers, magnificent cascades and majestic peaks. It is among the most sought after weekend getaways from Pune & Mumbai, located about 120km south-west of Pune and 285km from Mumbai.",Hotels,Local Shops,Car,Medium-Maharashtrian Cuisine,Mahabaleshwar,Mapro Garden,Lingmala Waterfall,Pratapgad Fort,3,5,3,1,3724,17.6868,73.7314
65,Manali,4.5," ""Lover's Paradise - India's Honeymoon capital"" "," With spectacular valleys, breathtaking views, snowcapped mountains, and lush forests of oak, deodar, and pine, Manali is a magical hill station at the northern end of Kullu valley in Himachal Pradesh. Gifted to the world by the mighty Himalayas, it is known to be one of the most popular destinations for Honeymooners. Manali offers magnificent views of the Pir Panjal and the Dhauladhar ranges, covered in a thick blanket of snow for most of the year.",Hotels,Local Markets,Car,High-Nice,North Indian Cuisine,Solang Valley,Hadimba Devi Temple,Manu Temple,3,5,3,2,3724,32.2396,77.1887
66,Matheran,4.3," ""Cutest little hill-station of India"" "," Nestled amidst the Sahyadri range on the Western Ghats, Matheran is a cosy little hill station that stands at an elevation of 2600 feet above sea level, and is just 100 kilometres away from Mumbai, making it the perfect weekend getaway. With its name literally translating to “overhead forest”, Matheran is the smallest hill station in India but is extremely popular in terms of tourists looking for a short trip amid spectacular vistas and serenity.",Hotels,Local Shops,Toy Train,Medium-Maharashtrian Cuisine,Matheran,Panorama Point,Louisa Point,Elephant's Head Point,2,5,2,1,3724,18.9847,73.267
67,Mathura,4.3," ""The hometown of Lord Krishna"" "," One of Hinduism's seven sacred cities, Mathura is the birthplace of the very beloved Lord Krishna. Located in the state of Uttar Pradesh, Mathura and Vrindavan are often considered twin cities (located only 10km away from each other). Mathura is a small town dotted with temples from various ages and attracts a horde of pilgrims from all over the world. ",Hotels,Local Markets,Auto Rickshaws,Medium-Nice,North Indian Cuisine,Shri Krishna Janmabhoomi,Kusum Sarovar,Gita Mandir,5,3,3,2,3724,27.1767,77.969
68,Mcleodganj,4.4," ""Land of His Holiness the Dalai Lama - Little Lhasa"" "," Mcleodganj, Himachal Pradesh is one of the most popular tourist destinations for it's tibetan culture, nature treks, greenery, ancient temples & monasteries, and british influence. Located in the Kangra district, it's on the outskirts of Dharamshala.Famous for being home to the Tibetan spiritual leader Dalai Lama, Mcleod Ganj is culturally blessed by a prominent Tibetan influence owing to the major settlement of Tibetans here who fled their homeland. It is also worth noting that Tibet's exiled government is also based solely in Mcleodganj which is also why it's called the Little Lhasa.",Hotels,Local Markets,Car,High-Nice,Tibetan Cuisine,Triund Hill,Namgyal Monastery,Bhagsu Waterfall,4,5,3,2,3678,32.2426,76.3214
69,Mount Abu,4.3," ""A beautiful hill station in Rajasthan"" "," The only hill station of Rajasthan, Mount Abu is located in the Aravali range. The most important attraction, however, are undoubtedly the Dilwara temples, which is one of the most stunning pieces of architecture in the country.  Travellers can enjoy calm and relaxed boating in Nakki Lake, and a view of the sunset from the vista points. The restaurants and eateries around the lake are great places to eat local food and chill. The highest peak of the Aravali Range - Guru Shikhar also lies in Mt. Abu. Mount Abu Forest Sanctuary with an abundance of flora and fauna is also a highlight.",Hotels,Local Markets,Car,Medium-Rajasthani Cuisine,Mount Abu,Dilwara Temples,Nakki Lake,Guru Shikhar,3,5,2,1,3724,24.5925,72.7156
70,Mumbai,4.2," ""The City of Dreams"" "," Mumbai, the capital city of the Indian state of Maharashtra, is a spectacular paradox of chaos and hope, glamour and squalor, modernity and tradition. Famously known as the City of Dreams, Mumbai – formerly known as Bombay - Mumbai is a beautifully blended melting pot of cultures and lifestyles.",Hotels,Malls,Metro,High-Great,Maharashtrian Cuisine,Gateway of India,Marine Drive,Elephanta Caves,3,4,5,4,3724,19.076,72.8777
71,Munnar,4.5," ""Kashmir of South India"" "," Famous for the tea estates, greenery, winding roads, blanket of mist, and viewpoints, Munnar is a hill station in Kerala, located in the Idukki district. Lying in the Western Ghats at 1600 metres, it is one of the most sought after and visited travel destinations globally, especially popular amongst honeymooners.",Resorts,Local Shops,Car,High-South Indian Cuisine,Munnar,Tea Gardens,Eravikulam National Park,Attukal Waterfalls,3,5,3,1,3782,10.0889,77.0595
72,Mussoorie,4.2," ""The queen of hill-stations"" "," Mussoorie is one of the most popular hill stations located at a distance of 290 km from Delhi in the Dehradun district of Uttarakhand. With a backdrop of the Shivalik range of Himalayas and doon valley, Mussoorie, also known as Queen of The Hills, stands at an altitude of 7000 feet above sea level. With a cool and pleasant climate throughout the year, Mussoorie was once the British summer capital.",Hotels,Local Markets,Car,Medium-Nice,North Indian Cuisine,Kempty Falls,Gun Hill,Camel's Back Road,2,5,3,2,5783,30.4591,78.0661
73,Mysore,4.2," ""Home to the Mysore Maharajas"" "," Famously known as The City of Palaces, it wouldn’t be wrong to say that Mysore, currently Mysuru, is one of the most important places in the country regarding ancient reigns. It is replete with the history of its dazzling royal heritage, intricate architecture, its famed silk sarees, yoga, and sandalwood, to name just a few. Located in the foothills of the Chamundi Hills, Mysore is the third most populated city in Karnataka, and its rich heritage draws millions of tourists all year round. The highlight is the majestic Mysore Palace, a UNESCO World Heritage Site, which is a must-visit.",Hotels,Markets,Auto Rickshaws,Medium-Great,South Indian Cuisine,Mysore Palace,Chamundi Hills,Sri Chamarajendra Zoological Gardens,2,5,3,2,3724,12.2958,76.6394
74,Nahan,3.9,"""the Town of ponds."""," Away from the buzzing crowd of the city, Nahan is a perfect romantic getaway. Lying among the lofty Shivalik range overlooking lush green fields, dirt free roads and clean streets, this small hill station serves as an ideal holiday destination.",Hotels,Local Markets,Car,Medium-Nice,North Indian Cuisine,Rani Tal,Suketi Fossil Park,Jaitak Fort,2,4,2,1,3563,30.5593,77.2996
75,Nainital,4.3," ""City of Lakes"" "," Nainital is a charming hill station located at the foothills of the Kumaon ranges in Uttarakhand. Located close to Dehradun and Delhi, it is the most visited hill station in North India. Nainital is a perfect weekend getaway from Delhi and the nearby places.",Hotels,Local Markets,Car,Medium-Nice,North Indian Cuisine,Naini Lake,Snow View Point,Naina Devi Temple,2,5,3,2,3724,29.3805,79.463
76,Nashik,4," ""Of Wines and Vineyards"" "," Nasik is a religious Hindu city, host to the Kumbh Mela every 12 years. It also makes for a perfect wine tasting destination.",Hotels,Markets,Auto Rickshaws,Medium-Maharashtrian Cuisine,Nashik,Sula Vineyards,Someshwar Temple,Pandavleni Caves,3,4,4,2,3724,20.5937,78.9629
77,Ooty,4.3," ""Queen of the Nilgiris"" "," Nestled amidst Nilgiri hills, Ooty, also known as Udagamandalam, is a hill station in Tamil Nadu which serves as a top-rated tourist destination. Once regarded as the summer headquarters of the East India Company, the Queen of the hills is a picturesque getaway.",Hotels,Markets,Toy Train,Medium-South Indian Cuisine,Ooty,Ooty Lake,Doddabetta Peak,Rose Garden,3,5,3,2,3724,11.4064,76.6932
78,Pachmarhi,4.4," ""Queen of the Satpuras"" "," Pachmarhi is the only hill station and is the highest point in Madhya Pradesh. Pachmarhi is also often known as ""Satpura ki Rani"" or the ""Queen of the Satpura Range"". Situated at an altitude of 1,067 metres, the picturesque town is a part of UNESCO Biosphere Reserve, home to leopards and bison.",Hotels,Local Shops,Car,Medium-Nice,Central Indian Cuisine,Dhoopgarh,Madhav National Park,Pandava Caves,2,5,2,1,2672,22.4674,78.4318
79,Pondicherry,4.1," ""The French Riviera of the East"" "," Pondicherry, officially known as Puducherry, and commonly referred to as just Pondy, is one of the seven Union Territories of India which is bounded by the southern state of Tamil Nadu. This former French colony is a perfect amalgamation of the traditional Indian sensibilities and French architecture, making it a dreamy escape that offers the best of both worlds.",Hotels,Markets,Auto Rickshaws,Medium-Great,French Cuisine,Promenade Beach,Auroville,Paradise Beach,4,4,3,2,3724,11.9139,79.8145
80,Poovar,4.3,"""'Lion of Kerala',"""," Poovar is a small rustic town situated 27 kms from Thiruvananthapuram with unspoilt, unexplored golden sand beaches and beautiful backwaters of Kerala.",Resorts,Local Shops,Boat,High-Kerala Cuisine,Poovar,Poovar Island,Kovalam Beach,Golden Sand Beach,2,5,3,1,3724,8.401,77.0659
81,Pune,4.1," ""Oxford of the East"" "," Pune is a bustling metropolis of Maharashtra, ranked number one in India in the ease of living. Often referred to as the Oxford of the East, it is a hub of diverse people and activities and is in rapidly growing into one of the top metropolitan cities in the country. Pune is a city that perfectly blends modernity with tradition sprinkled with colonial-era charm, and it deserves the title of being the cultural capital of Maharashtra.",Hotels,Malls,Auto Rickshaws,Medium-Great,Maharashtrian Cuisine,Shaniwar Wada,Aga Khan Palace,Sinhagad Fort,3,4,5,3,3724,18.5204,73.8567
82,Puri,4.3," ""Rath Yatra and the Beaches"" ", Puri in Odisha is one of the four must-visit pilgrimage sites for Hindus because of Jagannath Temple that forms the part of Char Dham in India. Puri is a beach city located on the coast of Bay of Bengal which is one of the favourites among people of West Bengal for a short trip.,Hotels,Markets,Auto Rickshaws,Medium-Great,Odia Cuisine,Jagannath Temple,Konark Sun Temple,Puri Beach,5,3,3,2,3724,19.8134,85.8315
83,Pushkar,4," ""The Only Dedicated Brahma Temple and the Mesmerising Cattle Fair"" "," Pushka is a small temple town located around 15 km from Ajmer in Rajasthan. A perfect choice for a weekend getaway from Jaipur, Pushkar has an array of cafes and hostels for a backpacking trip. Every November, Pushkar is host to the Pushkar Mela, one of the biggest camel fairs in the country.",Hotels,Local Markets,Auto Rickshaws,High-Rajasthani Cuisine,Pushkar,Brahma Temple,Pushkar Lake,Savitri Temple,5,3,4,3,3724,26.4875,74.55
84,Rameshwaram,4.1," ""The Bridge on the Indian Ocean"" "," Rameshwaram is located on a beautiful island in the South Indian state of Tamil Nadu. It is separated by a small Pamban channel from Sri Lanka. According to Hindu mythology, this is the place where Lord Rama created a bridge across the sea to Sri Lanka.",Hotels,Local Markets,Auto Rickshaws,Medium-Tamil Cuisine,Rameshwaram,Ramanathaswamy Temple,Dhanushkodi,Agnee Theertham,5,4,2,1,3724,9.2885,79.3129
85,Ranthambore,4.3," ""One of the best national parks of the country"" "," This is one of the best tiger reserves of the country, known to have ""friendly"" tigers and chances of sighting one here is reasonably better than many other tiger reserves of India. Along with this Ranthambore has one of the richest flora and fauna making it an absolutely must visit area",Resorts,Local Markets,Jeep Safari,High-Nice,Rajasthani Cuisine,Ranthambore National Park,Ranthambore Fort,Trinetra Ganesh Temple,2,5,2,1,3728,26.0167,76.65
