No,Destination,Ratings,Tags,Description,Accommodation,Shopping,Transportation,AdventureLevel,Cuisine,Tourist_Attraction_1,Tourist_Attraction_2,Tourist_Attraction_3,Spiritual,Nature,Crowded,Nightlife,Average Budget,Latitude,Longitude
86,Rishikesh,4.3," ""Yoga Capital of the World"" "," Located in the foothills of the Himalayas along the convergence of Ganga and Chandrabhaga River, Rishikesh is a small town in the Dehradun district, located close to Haridwar in Uttarakhand. Rishikesh (also called as Hrishikesh) is known for its adventure activities, ancient temples, popular cafes and as the ""Yoga Capital of the World"". Gateway to Garhwal Himalayas, Rishikesh is also a pilgrimage town and one of the holiest places for Hindus.",Hotels,Local Markets,Auto Rickshaws,High-Nice,North Indian Cuisine,Laxman Jhula,Triveni Ghat,The Beatles Ashram,4,5,3,2,3972,30.0869,78.2676
87,Shimla,4.3," ""The Hill-Station with Rich Colonial History"" "," Shimla is the capital of Himachal Pradesh and a popular hill-station among Indian families and honeymooners. Situated at the height of 2200m, it was the summer capital of British India. The hill station still retains its old-world charm with beautiful colonial architecture, pedestrian-friendly Mall Road and the ridge lined up with multiple shops, cafes and restaurants.",Hotels,Local Markets,Car,Medium-Nice,North Indian Cuisine,The Ridge,Jakhoo Temple,Christ Church,3,5,3,3,2748,31.1048,77.1734
88,Shimoga (Shivamogga),4.4," ""A Backpacker's Paradise"" "," With nature in its full bloom, the town of Shimoga has been home to several great dynasties and kingdoms. Packed with several marvels of nature in the form of picturesque landscape, gorgeous waterfalls, mystical temples and lush green surroundings, its raw beauty will leave you absolutely enchanted. The main city of Shimoga District derives its name from the words 'Shiv-Mukha' implying 'Face of Lord Shiva'.",Hotels,Local Markets,Bus,Medium-South Indian Cuisine,Shimoga (Shivamogga),Jog Falls,Sakrebailu Elephant Camp,Koodli,2,5,1,1,2671,13.9298,75.5681
89,Shirdi,4.4," ""The land of Sai Baba"" "," Located at a distance of 122 Km from Nasik in the Ahmednagar district of Maharashtra, Shirdi is the home of Sai Baba. It is believed that Sai Baba arrived at Shirdi in 1858 and spent 60 years of his life here until he attained salvation in 1918. Sai Baba is popularly known as the 'child of God', as he always spread the message of universal brotherhood.",Hotels,Local Shops,Auto Rickshaws,Medium-Nice,Maharashtrian Cuisine,Sai Baba Samadhi Mandir,Shani Shingnapur,Trikuteshwar Temple,5,3,2,1,3724,19.7515,74.4783
90,Srinagar,4.5," ""The Paradise on Earth"" "," Famously known as 'Heaven on Earth, Srinagar is located in the union territory of Jammu & Kashmir, on the banks of river Jhelum. Srinagar is known for the stationary houseboats and gondola-type rowboats- Shikaras on Dal Lake. Adorned with tranquil Dal Lake & Nigeen Lake, Srinagar is the dream destination for honeymoon and family holidays.",Houseboats,Local Markets,Shikara,High-Kashmiri Cuisine,Srinagar,Dal Lake,Shalimar Bagh,Nishat Bagh,4,5,3,2,3679,34.0836,74.7973
91,Thanjavur,4.4," ""City of Temples"" "," Also known as Tanjore or the city of temples, Thanjavur has a lot of cultural value and is known for its famous Tanjore paintings, antiques and handicrafts, textiles and saris , its Carnatic music and musical instruments and of course the temples.",Hotels,Local Markets,Auto Rickshaws,Medium-Tamil Cuisine,Thanjavur,Brihadeshwara Temple,Thanjavur Palace,Saraswathi Mahal Library,4,3,3,2,3724,10.786,79.1378
92,Tirupati,4.5," ""Abode of Lord Venkateswara Swamy"" "," Situated in the Chittoor district of Andhra Pradesh, Tirupati is known for Lord Venkateshwara Temple, one of the most visited pilgrimage centers in the world. It is also one of the world's richest temples known by different names - Tirumala Temple, Tirupati Temple, and Tirupati Balaji Temple. Tirumala is one of the seven hills in Tirupati, where the main temple is located. The temple is believed to be where Lord Venkateshwara took the form of an idol and is home to the deity Govinda. Tirupati is one of India's oldest cities and is mentioned in many ancient Vedas and Puranas.",Hotels,Local Markets,Auto Rickshaws,Medium-Great,South Indian Cuisine,Tirumala Venkateswara Temple,Akasa Ganga,Kapila Theertham,4,3,3,2,5762,13.6288,79.4192
93,Udaipur,4.4," ""The city of Lakes"" "," Udaipur, also known as the City of Lakes, is one of the most visited tourist places in Rajasthan. Located around stunning water lakes and enveloped by the Aravalli Hills in all directions, Udaipur is known for its azure lakes, magnificent palaces, vibrant culture and delectable food. Along with being a must-visit destination, it is also one of the best places to experience luxury in India. ",Hotels,Markets,Auto Rickshaws,Medium-Rajasthani Cuisine,Udaipur,City Palace,Lake Pichola,Jag Mandir,4,5,3,2,3724,24.5854,73.7125
94,Ujjain,4.4," ""The Home of Mahakaleshwara"" "," Ujjain, considered to be one of the holiest cities of India, is an ancient city situated on the eastern bank of the Shipra River in the Malwa region of Madhya Pradesh. Ujjain is one of the four sites for the Kumbh Mela, the largest peace-time gathering on the planet that attracts 100 million people to the festival.",Hotels,Local Markets,Auto Rickshaws,Medium-Nice,Madhya Pradesh Cuisine,Mahakaleshwar Jyotirlinga,Kal Bhairav Temple,Sandipani Ashram,5,3,2,1,4683,23.2599,77.4126
95,Vaishno Devi,4.4," ""The Holy Caves"" "," Vaishno Devi is a temple town that's home to the famous Vaishno Devi Mandir. Located in Trikuta hills, 13 kms from Katra (in the union territory of Jammu and Kashmir); this renowned shrine allures millions of devotees from all over the world.  Popularly known as Mata Rani, Vaishnavi and Trikuta, Vaishno Devi is a manifestation of the Hindu Goddess Durga. It is believed that during the pooja and aarti, Goddesses arrive at the Holy cave to pay their respect to Mata Rani. Devotees believe the goddess herself calls the devotees to reach here.",Pilgrim Accommodations,Local Markets,Auto Rickshaws,Medium-Jammu Cuisine,Vaishno Devi,Vaishno Devi Temple,Bhairon Temple,Ardhkuwari Cave,5,3,2,1,3724,33.5248,74.8367
96,Varanasi,4.5," ""The Spiritual Capital of India"" "," World's oldest living city, Varanasi - also known as Kashi (City of Life) and Benaras, is the spiritual capital of India. It is one of Hinduism's seven holy cities. The old city of Varanasi lies along the western banks of the Ganges, spread across a labyrinth of narrow galis. Be prepared to walk on foot and encounter some holy cows! Temples at almost every turn engulf Varanasi but the Kashi Vishwanath Temple is the most visited and the oldest of the lot. Benaras is known as the city of Lord Shiva for a reason, and rightfully so.",Hotels,Local Markets,Boat,High-Nice,North Indian Cuisine,Kashi Vishwanath Temple,Ganga Aarti at Dashashwamedh Ghat,Sarnath,5,3,4,4,3724,25.3176,82.9739
97,Varkala,4.5," ""The hidden treasure of Kerala"" "," Varkala is a coastal town in the southern part of Kerala known for the unique 15m high 'Northern Cliff' adjacent to the Arabian Sea. It is popular for its hippie culture, shacks on the cliff serving great seafood and playing global music and the samadhi of Kerala's saint Sree Narayana Guru. Varkala is also known for Jardana Swami Temple, also known as Dakshin Kashi.",Resorts,Local Shops,Auto Rickshaws,Medium-Kerala Cuisine,Varkala,Varkala Beach,Janardanaswamy Temple,Sivagiri Mutt,2,5,3,2,3724,8.735,76.7038
98,Visakhapatnam,4.4," ""A gem of South India"" "," Visakhapatnam, also commonly known as Vizag, is one of the oldest port cities in the country. Situated in the heart of Andhra Pradesh, Vizag was announced as the state capital of Andhra Pradesh on January 31, 2023. The city is known for its picturesque beaches and serene landscape, as well as a rich cultural past. The port of Visakhapatnam is renowned for being home to the oldest shipyard in all of India. ",Hotels,Markets,Metro,Medium-Great,Andhra Cuisine,RK Beach,Kailasagiri,Borra Caves,3,5,4,2,1277,17.6868,83.2185
99,Vrindavan,4.3," ""Lord Krishna's childhood abode"" "," One of the oldest cities on the banks of Yamuna, Vrindavan is considered to be one of the most important places of pilgrimage for the devotees of Krishna. It is said that Lord Krishna had spent his childhood in Vrindavan. The name of the city has been derived from Vrinda (meaning basil) and van (meaning grove) which perhaps refer to the two small groves at Nidhivan and Seva Kunj. Since Vrindavan is considered to be a sacred place, a large number of people come here to abandon their worldly life.",Hotels,Local Markets,Auto Rickshaws,Medium-Nice,North Indian Cuisine,Banke Bihari Temple,ISKCON Temple,Govind Dev Temple,5,3,3,2,4673,27.5554,77.694
100,Wayanad,4.3," ""Nature's Abode"" "," Replete with waterfalls, historical caves, comfortable resorts and homestays, Wayanad in Kerala is famous for its spice plantations and wildlife. Walking through the sprawling spice plantations, trekking to the pre-historic caves and experiencing a resort holiday are one of the many things you can do to get a taste of Wayanad.",Resorts,Local Shops,Car,High-Kerala Cuisine,Wayanad,Edakkal Caves,Soochipara Falls,Chembra Peak,3,5,2,1,3724,11.6859,76.1376